company_name,contact_name,email,phone,city,region,company_type,specialization,website,source,notes
"СварМонтаж-Уфа","Иванов Сергей Петрович","zakup@svarmontazh-ufa.ru","+7 347 000-00-01","Уфа","Республика Башкортостан","retailer","сварочное оборудование, СИЗ, электроды","svarmontazh-ufa.ru","2gis","3 розничные точки, торгуют FUBAG и ESAB"
"ПромИнструмент","Кузнецова Ольга Андреевна","info@prominstrument-ural.ru","+7 343 000-00-02","Екатеринбург","Свердловская область","distributor","электроинструмент, СИЗ, расходники","prominstrument-ural.ru","yandex","крупный дистрибьютор по Уралу, интересуется оптом"
"ТехСнаб-Казань","","sales@techsnab-kzn.ru","","Казань","Республика Татарстан","retailer","СИЗ, сварочные материалы","techsnab-kzn.ru","exhibition","познакомились на выставке Weldex 2025"
"ОптСварка","Петров Алексей","opt@optsvarka.ru","+7 495 000-00-03","Москва","Москва","distributor","оптовая торговля сварочным оборудованием","optsvarka.ru","manual","потенциально крупный партнёр, дилеры ESAB/Kemppi"
"СтройБаза-Сибирь","Николаев Дмитрий","zakaz@stroybaza-sib.ru","+7 383 000-00-04","Новосибирск","Новосибирская область","retailer","стройматериалы, СИЗ, инструмент","stroybaza-sib.ru","2gis","сеть из 5 магазинов по Сибири"
